<?xml version="1.0" encoding="utf-8"?>
<timeTable 
	xmlns:xsi="http://www.w3.org/2001/XMLSchema-instance"
	xsi:noNamespaceSchemaLocation="project.xsd">
	<studentName name ="Alan Rocky"></studentName>
	<studentId>901011</studentId>
	<program>Economics</program>
	<school schoolName="Western College"/>
	<term>W2020</term>
	<week>
		<day1>
			<dayName>Monday</dayName>
			<hour>
				<startTime>1000</startTime>
				<course>ECON-1122</course>
				<room>R1122</room>
			</hour>
			<hour>
				<startTime>1200</startTime>
				<course>ECON-1234</course>
				<room>R0123</room>
			</hour>
			<hour>
				<startTime>1500</startTime>
				<course>ECON-2233</course>
				<room>R0124</room>
			</hour>
		</day1>
		<day2>
			<dayName>tuesday</dayName>
			<hour>
				<startTime>800</startTime>
				<course>ECON-1122</course>
				<room>R0122</room>
			</hour>
			<hour>
				<startTime>1100</startTime>
				<course>ECON-1234</course>
				<room>R0134</room>
			</hour>
			<hour>
				<startTime>1700</startTime>
				<course>ECON-2233</course>
				<room>R0024</room>
			</hour>
		</day2>
		<day3>
			<dayName>Wedesday</dayName>
			<hour>
				<startTime>1400</startTime>
				<course>ECON-1122</course>
				<room>R0144</room>
			</hour>
			<hour>
				<startTime>1600</startTime>
				<course>ECON-2233</course>
				<room>R0155</room>
			</hour>
			<hour>
				<startTime>2000</startTime>
				<course>ECON-1234</course>
				<room>R003</room>
			</hour>
		</day3>
		<day4>
			<dayName>Thursday</dayName>
			<hour>
				<startTime>1500</startTime>
				<course>ECON-2233</course>
				<room>R0133</room>
			</hour>
			<hour>
				<startTime>1200</startTime>
				<course>ECON-1122</course>
				<room>R0043</room>
			</hour>
			<hour>
				<startTime>1300</startTime>
				<course>ECON-1234</course>
				<room>R0111</room>
			</hour>
		</day4>
		<day5>
			<dayName>friday</dayName>
			<hour>
				<startTime>1400</startTime>
				<course>ECON-2233</course>
				<room>R0111</room>
			</hour>
			<hour>
				<startTime>1300</startTime>
				<course>ECON-2222</course>
				<room>R0051</room>
			</hour>
			<hour>
				<startTime>1600</startTime>
				<course>ECON-2233</course>
				<room>R011</room>
			</hour>
			<hour>
				<startTime>2000</startTime>
				<course>ECON-3333</course>
				<room>R0166</room>
			</hour>
		</day5>
	</week>

</timeTable>
